{
  "$schema": "../../packages/shou-contracts/rule.schema.json",
  "schema_version": "1.0",
  "id": "dev.npm-node-modules",
  "version": "0.1.0",
  "name": "Installed npm dependencies for inactive-project review",
  "description": "High-risk review example for node_modules whose parents contain both package.json and package-lock.json. Installed dependencies are not ordinary caches.",
  "platforms": ["macos"],
  "scope": {
    "root_ref": "developer-workspaces",
    "max_depth": 8,
    "follow_symlinks": false,
    "cross_filesystems": false
  },
  "match": {
    "kind": "directory",
    "relative_patterns": ["**/node_modules"],
    "project_markers": {"location": "parent", "all_of": ["package.json", "package-lock.json"]}
  },
  "conditions": {
    "min_allocated_bytes": 524288000,
    "newest_descendant_modified_days_at_least": 30
  },
  "exclude": {"relative_patterns": ["active-project/**", "offline-project/**", "**/.git/**"]},
  "risk": {
    "declared_level": "high",
    "rebuild_note": "Reinstallation may be possible using the project's documented procedure only when manifests, lockfiles, the toolchain, and all dependencies remain available and no local changes need preservation. Shou does not run installation commands automatically.",
    "limitations": [
      "Manifests and lockfiles establish project structure, not continued dependency availability.",
      "Review private registries, offline dependencies, install scripts, manual edits, and local patches individually.",
      "Not applicable to pnpm, Yarn zero-installs, shared stores, or local workspace dependencies with unverified reinstallation conditions. Treat recognized symbolic links as opaque entries and never follow them.",
      "Age conditions do not prove inactivity. Explicitly exclude active projects and projects needed for offline work."
    ]
  },
  "action": {"type": "trash"}
}
